Name,Price
"GIGABYTE GeForce RTX 4070 Ti GAMING OC 12G Graphics Card, 3x WINDFORCE Fans, 12GB 192-bit GDDR6X, GV-N407TGAMING OC-12GD Video Card",849.0
MSI Gaming GeForce RTX 4070 Ti 12GB GDDR6X PCI Express 4.0 Video Card RTX 4070 Ti GAMING X TRIO 12G,943.0
"ASUS TUF Gaming NVIDIA GeForce RTX 4070 Ti OC Edition Gaming Graphics Card (PCIe 4.0, 12GB GDDR6X, HDMI 2.1a, DisplayPort 1.4a) TUF-RTX4070TI-O12G-GAMING",849.0
MSI Gaming GeForce RTX 4080 16GB GDDR6X PCI Express 4.0 Video Card RTX 4080 16GB GAMING X TRIO,1199.0
Average,1006.39
